,UserName,RetweetCount,Timestamp,Text_clean,CriminalityRelated
1144,324.cat,1.0,2023-06-08T16:00:15.000Z,segons el jurat del premi llibreter   els irredempts  de la vallesana cristina garcia molina  destil la una  intel ligencia aclaparadora  on excel leixen els llenguatges  les idees i l art,0
1145,324.cat,1.0,2023-06-08T15:26:00.000Z,l oficina antifrau de catalunya va rebre 554 denuncies durant el 2022 i calcula que aquest any en rebra prop de 800  i reclama poder disposar de mes eines sancionadores i coactives,0
1146,324.cat,5.0,2023-06-08T15:08:00.000Z,la generalitat valenciana desmenteix en un comunicat que hi hagi cap acord tancat amb la multinacional tesla  amb la qual estaria negociant una inversio de 4.000 milions d euros en una nova fabrica,0
1147,324.cat,24.0,2023-06-08T15:02:00.000Z,denuncien l estat espanyol per la regressio del delta un grup de veins presenten una demanda legal perque l estat actui per preservar la integritat del territori i reclamen 22 milions d euros per les perdues en finques i collites,0
1148,324.cat,14.0,2023-06-08T14:52:00.000Z,la justicia belga ha admes a tramit una querella de l ong plataforma per la llengua  que acusa l estat espanyol d haver espiat directius de l entitat que viuen a belgica infectant los el mobil,0
1149,324.cat,27.0,2023-06-08T14:50:00.000Z,quatre nens i un adult ferits quan un home els ha atacat amb un ganivet mentre eren en un parc d annecy  a franca es troben en estat critic,1
1150,324.cat,13.0,2023-06-08T14:44:22.000Z,l eurozona entra en recessio  arrossegada per alemanya  ,0
1151,324.cat,14.0,2023-06-08T14:30:00.000Z,el jaciment de la roca de les ferradures  als cogullons  a les muntanyes de prades  podria ser molt mes gran del que es pensava els arqueolegs hi han trobat mes de 250 gravats rupestres postpaleolitics de formes molt diverses i en molt bones condicions,0
1152,324.cat,2.0,2023-06-08T14:15:00.000Z,la barra del bar de  cheers  les disfresses de  batman i robin  o les eines per cuinar amfetamina a  breaking bad  entre els articles que han triomfat mes en una subhasta d objectes apareguts en series i programes de televisio als estats units,0
1153,324.cat,248.0,2023-06-08T14:03:43.000Z,  ultimahora tenir unes vacances ja contractades permetra no ser a la mesa electoral el 23j   ,0
1154,324.cat,1.0,2023-06-08T13:51:01.000Z,mexic investiga l actuacio d uns militars que van matar 5 homes a la frontera amb els eua  ,1
1155,324.cat,2.0,2023-06-08T13:41:00.000Z,aixi han estat els examens de dibuix artistic  llati i matematiques de la selectivitat  consulta n les preguntes i la correccio  pau23cat,0
1156,324.cat,32.0,2023-06-08T13:33:57.000Z,puigdemont demana al suprem que anul li el seu processament i torni a la casella de sortida  ,0
1157,324.cat,2.0,2023-06-08T13:16:00.000Z,el tjue dictamina que no es poden limitar els vtc per protegir els taxis  pero admet que es puguin exigir llicencies per regular el sector d acord amb  les necessitats particulars  de l area de barcelona,0
1158,324.cat,42.0,2023-06-08T13:13:38.000Z,s investiguen 8 agressions sexuals grupals a menors a badalona els ultims 11 mesos  ,1
1159,324.cat,56.0,2023-06-08T13:08:00.000Z,degoteig d acusacions contra el cantant de rammstein  de fans que diuen que una col laboradora de la banda seleccionava noies i  en alguns casos  les drogaven  perque tinguessin relacions sexuals amb ell,0
1160,324.cat,4.0,2023-06-08T12:57:00.000Z,la destruccio de l embassament es un altre cop dur per a la malmesa agricultura ucrainesa  584.000 hectarees de conreu podrien quedar sense reg  l equivalment a tota la provincia de girona,0
1161,324.cat,6.0,2023-06-08T12:50:00.000Z,amb una imatge d ella mateixa sotmetent se a radioterapia  l actriu nord americana shannen doherty ha reconegut que esta  aterrida  pel diagnostic de metastasi al cervell,0
1162,324.cat,1.0,2023-06-08T12:15:29.000Z,detingut un dels quatre fugitius que han disparat a darnius contra la guardia civil  ,1
1163,324.cat,5.0,2023-06-08T12:14:43.000Z,la meitat d infants que es queden a casa per motius de salut es per asma o al lergia  ,0
1164,324.cat,8.0,2023-06-08T12:03:14.000Z,  ultimahora cristina garcia molina  premi llibreter de literatura en catala amb  els irredempts    ,0
1165,324.cat,7.0,2023-06-08T11:52:00.000Z,propietaris agricoles demanden l estat espanyol per la regressio del delta de l ebre  ,0
1166,324.cat,2.0,2023-06-08T11:46:48.000Z,antifrau supera el record de denuncies i demana reforcos i mes capacitat sancionadora  ,0
1167,324.cat,9.0,2023-06-08T11:38:00.000Z,els origens de la masturbacio en els primats se situen fa uns 40 milions d anys  segons un dels estudis mes complerts que s han fet mai sobre aquesta questio  publicat a proceedings of the royal society b,0
1168,324.cat,24.0,2023-06-08T11:26:38.000Z,  ultimhora tesla podria invertir mes de 4.000 milions d euros en una fabrica al pais valencia  ,0
1169,324.cat,1.0,2023-06-08T11:22:00.000Z,la destruccio de la gran presa hidraulica de kakhovka sobre el riu dnieper  al sud d ucraina  ha deixat un paisatge de devastacio mira l abans i el despres,0
1170,324.cat,17.0,2023-06-08T11:15:00.000Z,plataforma per la llengua acusa l estat espanyol de ciberespionatge per  suposadament  haver infectat telefons de membres de la direccio que viuen a belgica,0
1171,324.cat,23.0,2023-06-08T11:03:00.000Z,troben mes de 250 gravats prehistorics a les roques de les muntanyes de prades  ,0
1172,324.cat,1.0,2023-06-08T10:56:59.000Z,la barra del bar de  cheers  entre els curiosos articles de programes de tv d una subhasta  ,0
1173,324.cat,6.0,2023-06-08T10:49:31.000Z,aixi ha estat l examen d historia de la selectivitat  amb preguntes sobre el final de la guerra civil a catalunya  la politica exterior del franquisme o els fets d octubre del 1934,0
1174,324.cat,7.0,2023-06-08T10:38:00.000Z,les autoritats de ciutats com nova york  filadelfia o washington han demanat als ciutadans que no surtin al carrer si no es necessari per la mala qualitat de l aire a causa dels incendis del canada,0
1175,324.cat,42.0,2023-06-08T10:16:23.000Z,dos infants d uns 3 anys i un adult estan en estat critic arran de l atac amb ganivet a la ciutat francesa d annecy  ,1
1176,TV3.cat,7.0,2023-06-08T10:00:02.000Z, estrenem en exclusiva digital a tv3alacarta  punt de no retorn  una serie documental en format curt del periodista   raulgaab   al primer capitol  accedim a l ala militar de la jihad islamica palestina  les brigades d al quds   puntnoretorntv3    ,0
1177,324.cat,,2023-06-08T09:55:00.000Z,l actriu shannen dohorety va explicar l any 2020 que tornava a tenir cancer de mama  i els darrers anys ha treballat per visibilitzar la malaltia i conscienciar la poblacio,0
1178,324.cat,16.0,2023-06-08T09:51:22.000Z,fans de rammstein acusen el cantant d agressions sexuals organitzades  ,1
1179,324.cat,5.0,2023-06-08T09:38:00.000Z,la triple devastacio que deixa la destruccio de la immensa presa a ucraina  desenes de milers de persones sense aigua potable ni llum  milers d animals morts i perdues milionaries,0
1180,324.cat,10.0,2023-06-08T09:37:58.000Z,busquen quatre fugitius que han disparat a darnius contra la guardia civil  ,1
1181,324.cat,161.0,2023-06-08T09:12:51.000Z,  ultimahora diversos ferits  la majoria infants  en un atac amb arma blanca a franca  ,1
1182,324.cat,61.0,2023-06-08T08:56:10.000Z,belgica investiga espanya per espiar dirigents de plataforma per la llengua que viuen alla  ,0
1183,324.cat,54.0,2023-06-08T08:31:35.000Z,l advocat gonzalo boye ja ha arribat al suprem  que aquest mati acull una vista clau per als exiliats de l 1 o un cop hagi deliberat la sala d apel lacions  sabrem per quins delictes la justicia espanyola reclama puigdemont  comin  ponsati  puig i rovira  ,0
1184,324.cat,,2023-06-08T08:21:00.000Z,la guerra d ucraina agreuja la crisi climatica  xifres i causes     eltempstv3,0
1185,324.cat,171.0,2023-06-08T08:05:10.000Z, ultimahora la justicia europea diu que no es poden limitar les llicencies de vtc a barcelona  ,0
1186,324.cat,,2023-06-08T07:33:00.000Z,som davant el dia mes tranquil de la setmana  amb ruixats que tornaran tots els detalls del temps amb l   eloicordomi  al 324     eltempstv3,0
1187,324.cat,24.0,2023-06-08T07:18:00.000Z,un dels encarregats de la proteccio i seguretat del president del tribunal constitucional ha acabat detingut per haver col laborat en la simulacio d un segrest a canvi de diners i cocaina,1
1188,324.cat,10.0,2023-06-08T07:08:00.000Z,el volca kilauea  situat prop de la ciutat costanera i mes poblada de hawaii  ha entrat en erupcio per segona vegada aquest any,0
1189,324.cat,6.0,2023-06-08T06:58:00.000Z,un estudi de la university college de londres planteja noves hipotesis sobre els avantatges de la masturbacio com a element de seleccio evolutiva en els mascles,0
1190,324.cat,7.0,2023-06-08T06:48:00.000Z,absolen l exeducador del centre de menors de la dgaia a teia  al maresme  que va ser jutjat per agressions sexuals a un adolescent de 13 anys amb autisme,0
1191,324.cat,14.0,2023-06-08T06:42:00.000Z,l alerta per la qualitat de l aire a causa dels incendis forestals al sud del canada s ha estes al nord est dels estats units i afecta 100 milions de ciutadans,0
1192,324.cat,,2023-06-08T06:41:00.000Z,el sector de les vtc de catalunya  pendent del pronunciament avui del tribunal de la ue  ,0
1193,324.cat,,2023-06-08T06:36:00.000Z,dia assolellat  amb boires matinals i nuvols prims a partir del migdia  que filtraran la llum del sol de ruixats  pocs i molt localitzats     eltempstv3    arenysdemunt     perell65,0
1194,324.cat,9.0,2023-06-08T06:28:00.000Z,els ciutadans d un poble de salamanca hauran de tornar a votar els seus regidors a l ajuntament la junta electoral ha ordenat repetir les eleccions municipals perque l alcalde va passejar l urna pel poble durant la votacio,0
1195,324.cat,1.0,2023-06-08T06:18:00.000Z,de moment hi ha tres hipotesis en el cas de la destruccio de la presa de kakhovka  una explosio provocada pels rusos  pels propis ucrainesos o un accident provocat per la pressio de l aigua,0
1196,324.cat,1.0,2023-06-08T06:08:00.000Z,l home que va assassinar la dona i la filla de 3 anys la nit de reis del 2020  condemnat a preso permanent revisable el jurat va descartar que cometes els crims condicionat per un trastorn mental,1
1197,324.cat,1.0,2023-06-08T05:58:00.000Z,els mossos desallotgen la  rave  d ivars de noguera  amb un detingut  una vintena de denunciats i la resta de participants identificats,1
1198,324.cat,6.0,2023-06-08T05:51:00.000Z,desastre humanitari  ecologic i economic  devastacio a ucraina per la destruccio de la presa  ,0
1199,324.cat,5.0,2023-06-08T05:48:00.000Z,el malestar de les adf i agents rurals forca el govern a posposar els canvis que havia previst dins del pla infocat i deixar la reforma per a la tardor,0
1200,324.cat,13.0,2023-06-08T05:41:00.000Z,shannen doherty  de  sensacion de vivir  revela que te metastasi al cervell   estic aterrida   ,0
1201,324.cat,2.0,2023-06-08T05:38:00.000Z,les fotografies de satel lit de l abans i el despres de la destruccio de la presa ucrainesa de kakhovka fan evident la devastacio de les inundacions,0
1202,324.cat,,2023-06-08T05:31:00.000Z,vista clau al suprem per al futur de puigdemont i els altres exiliats de l 1 o  ,0
1203,324.cat,2.0,2023-06-08T05:28:00.000Z,l organitzacio de l ultima cimera de la comunitat politica europea ha estat la gran oportunitat de moldavia per fer se valdre exhibint una bona integracio dels refugiats d ucraina i oferint garanties de seguretat per a europa,0
1204,324.cat,2.0,2023-06-07T22:04:00.000Z,la sentencia que absol l exeducador del centre de menors de la dgaia considera que la declaracio de la victima  en que explicava que havia patit 4 violacions i que era l unica prova per acreditar els fets  es insuficient,0
1205,324.cat,8.0,2023-06-07T21:55:00.000Z,canvis en les alertes meteorologiques de perill  es crea un nou avis de calor nocturna   ,0
1206,324.cat,40.0,2023-06-07T21:40:00.000Z,la massificacio de turistes a barcelona afecta punts molt concrets de la ciutat  com la rambla o la sagrada familia  i aixo condiciona la mobilitat dels veins  segons un estudi,0
1207,324.cat,6.0,2023-06-07T21:35:09.000Z,els mossos deixen en llibertat el detingut durant la protesta antimonarquica de girona  ,0
1208,324.cat,10.0,2023-06-07T21:23:00.000Z,el kilauea  considerat un dels volcans mes actius del mon  torna a entrar en erupcio a l illa de hawaii,0
1209,324.cat,9.0,2023-06-07T21:20:00.000Z,troben per primer cop l esquelet sencer d una gran au aquatica que va viure fa 3 milions d anys a la zona de caldes de malavella  al jaciment del camp dels ninots  un dels mes importants d europa,0
1210,324.cat,30.0,2023-06-07T21:11:00.000Z,cobrar per l equipatge de ma o per triar seient podrien ser practiques  abusives o deslleials que vulneren els drets del consumidor ,0
1211,324.cat,4.0,2023-06-07T21:07:00.000Z,continuen investigant que hi ha rere la destruccio de la presa de kakhovka  a ucraina  que ha provocat una contundent riuada i que posa en perill 42.000 persones,0
1212,324.cat,80.0,2023-06-07T20:50:00.000Z,un empresari madrileny que havia faltat a la feina per anar de festa hauria donat 500eur i cocaina a tres policies a canvi d ajuda per simular un segrest per justificar se,0
1213,324.cat,3.0,2023-06-07T20:34:00.000Z,moldavia va trucar a la porta de la unio europea nomes set dies despres que comences la guerra entre ucraina i russia,0
1214,324.cat,2.0,2023-06-07T20:27:00.000Z,els ministres miquel iceta i raquel sanchez aniran de segon i de tercera en la llista del psc per al 23j  encapcalada per meritxell batet,0
1215,324.cat,4.0,2023-06-07T20:17:00.000Z,durant el desallotjament de la  rave  d ivars de noguera  els mossos han detingut l home acusat d haver agredit dilluns els agents que custodiaven l entrada i fugir,1
1216,324.cat,1.0,2023-06-07T20:11:00.000Z,el suprem ha revisat una trentena de recursos per l aplicacio de la llei del  nomes si es si  i  en contra del que defensa la fiscalia  ha avalat que es rebaixi la pena encara que la condemna sigui ferma,0
1217,324.cat,17.0,2023-06-07T20:00:42.000Z,la masturbacio en els primats podria tenir un proposit evolutiu  segons un estudi  ,0
1218,324.cat,15.0,2023-06-07T19:48:31.000Z,incendis al canada  100 milions de nord americans en alerta per la qualitat de l aire  ,0
1219,324.cat,11.0,2023-06-07T19:41:00.000Z,l informe de la consultora deloitte recull les principals preocupacions dels millennials i de la generacio z  entre les quals  l estres que pateixen,0
1220,324.cat,5.0,2023-06-07T19:35:00.000Z,un altre exalumne del col legi casp de barcelona ha denunciat el jesuita francesc peris per abusos sexuals  ara te 40 anys i els fets denunciats van passar a finals de la decada del 1990,1
1221,324.cat,2.0,2023-06-07T19:34:00.000Z,dijous amb mes sol i calor els nuvols tornaran a ser mes abundants de cara al vespre la meteo del   324cat  amb   jjanue     eltempstv3,0
1222,324.cat,5.0,2023-06-07T19:30:00.000Z,l alcalde d un poble de salamanca de 61 habitants i el president de la mesa electoral el 28m van endur se l urna del col legi perque les persones amb mobilitat reduida poguessin votar  i ara la junta electoral ha ordenat repetir les eleccions,0
1223,324.cat,4.0,2023-06-07T19:25:00.000Z,el departament d interior ajorna la reforma del pla d incendis forestals  que ha creat malestar perque limita el paper dels agents rurals i les adf,0
1224,Esport3,23.0,2023-06-07T19:04:38.000Z, ultima hora    leo messi fa oficial el seu fitxatge per l inter de miami,0
1225,324.cat,2.0,2023-06-07T19:20:00.000Z,l audiencia de barcelona ha condemnat a preso permanent revisable l home que va assassinar la dona i la filla de 3 anys la nit de reis del 2020 a esplugues de llobregat,1
1226,324.cat,10.0,2023-06-07T19:15:00.000Z,absolen un exeducador d un centre de menors de la dgaia a teia d agressio sexual a un nen de 13 anys amb autisme  ,1
1227,324.cat,29.0,2023-06-07T19:10:00.000Z,el volca kilauea  un dels mes actius del mon  entra en erupcio i fa tremolar hawaii  ,0
1228,324.cat,48.0,2023-06-07T19:02:41.000Z,un detingut  tensio i cops de porra en una manifestacio antimonarquica a girona  ,0
1229,324.cat,74.0,2023-06-07T18:55:00.000Z, tinc mal de cap des que em llevo fins que me n vaig a dormir em molesta  fins i tot  l aigua de la dutxa  el carlos te migranya  una malaltia que afecta el 14 per cent  de la poblacio l   hgermanstrias  ha descobert que es podria detectar amb una simple ecografia  ,0
1230,324.cat,2.0,2023-06-07T18:50:00.000Z,abans i despres de la destruccio  imatges des de l aire de la devastacio a la presa d ucraina  ,0
1231,324.cat,3.0,2023-06-07T18:45:00.000Z,una gran au aquatica va ser arrossegada fins a un llac subtropical que hi havia fa 3 milions d anys a la zona de caldes de malavella ara se n ha trobat l esquelet  feia entre un metre i un metre i mig i pesava entre 4 i 8 quilos,0
1232,324.cat,4.0,2023-06-07T18:30:00.000Z,l informe policial contradiu l acusacio particular exercida per l extrema dreta i desmenteix que monica oltra elimines cap correu electronic amb instruccions per encobrir l exmarit condemnat per abusos sexuals,0
1233,324.cat,1.0,2023-06-07T18:23:00.000Z,les victimes que han denunciat agressions sexuals per part del professor de karate de l esportiu claret de barcelona eren menors d edat en el moment dels fets,0
1234,324.cat,12.0,2023-06-07T18:10:00.000Z, qui havia de dir al meu fill  que viu en un poble de 1.200 habitants  que es convertiria en segell oficial de noruega  un nen de nou anys de ribes de freser es la imatge de turisme de noruega,0
1235,324.cat,11.0,2023-06-07T17:53:21.000Z,detingut un escorta del president del tribunal constitucional per simular un segrest  ,1
1236,324.cat,3.0,2023-06-07T17:27:00.000Z,la presidenta del congres  meritxell batet  encapcalara per quart cop la llista del psc per barcelona en unes eleccions generals,0
1237,324.cat,4.0,2023-06-07T17:22:00.000Z,el suprem discrepa de la fiscalia i confirma les rebaixes de penes a delinquents sexuals en aplicacio de la llei del  nomes si es si ,0
1238,324.cat,6.0,2023-06-07T17:16:26.000Z,un detingut en el desallotjament de la  rave  d ivars de noguera  que ha durat 5 dies  ,1
1239,324.cat,116.0,2023-06-07T17:11:00.000Z,investiguen set aerolinies de baix cost per cobrar per l equipatge de ma i per l assignacio de seients  que podrien ser practiques  abusives o deslleials  que violen els drets dels consumidors,0
1240,324.cat,1.0,2023-06-07T16:59:00.000Z,el papa francesc supera sense complicacions l operacio d hernia abdominal a que ha estat sotmes i que ha durat tres hores,0
1241,324.cat,25.0,2023-06-07T16:59:00.000Z,les caotiques oposicions de finals d abril que es van haver d anul lar i s hauran de repetir costaran al govern 1.200.000 euros en indemnitzacions als afectats,0
1242,324.cat,5.0,2023-06-07T16:41:00.000Z,aixi han estat els examens de la selectivitat d analisi musical  ciencies de la terra i de medi ambient  cultura audiovisual  fisica i geografia  consulta n les preguntes i la correccio  pau23cat,0
1243,324.cat,83.0,2023-06-07T16:30:01.000Z,un poble de salamanca repetira les eleccions perque l alcalde es va endur l urna  ,0
1244,324.cat,4.0,2023-06-07T16:25:00.000Z,el popular actor nord america cuba gooding jr evita un nou judici per violacio perque arriba a un acord amb una dona que l acusava fa un any ja el van declarar culpable d un altre altre cas d agressio sexual,0
1245,324.cat,2.0,2023-06-07T16:19:27.000Z,preso permanent revisable per a l home que va assassinar la dona i la filla a esplugues  ,1
1246,324.cat,1.0,2023-06-07T16:15:00.000Z,amb l increment del 3 5 per cent  del preu de l habitatge  s encadenen ja 36 trimestres amb els preus a l alca,0
1247,324.cat,8.0,2023-06-07T16:10:00.000Z,el servei meteorologic crea un nou avis de calor nocturna que s activara quan les temperatures dificultin el descans a la nit o comportin un perill per a la poblacio la prova pilot comencara a les comarques del litoral i prelitoral catala,0
1248,324.cat,4.0,2023-06-07T16:03:38.000Z,l oposicio d agents rurals i adf forca l ajornament de la reforma del pla d incendis  ,0
1249,324.cat,3.0,2023-06-07T15:51:00.000Z,una empresa italiana volia utilitzar el logo de batman per als seus productes  pero el tribunal de justicia europeu ha considerat que la famosa imatge del ratpenat pertany nomes a dc comics,0
1250,324.cat,8.0,2023-06-07T15:40:00.000Z,un home de 40 anys ha denunciat als mossos els abusos sexuals que va patir quan en tenia 15 per part de francesc peris  el jesuita que el 2005 van apartar de la docencia al col legi casp de barcelona,1
1251,324.cat,33.0,2023-06-07T15:31:15.000Z,troben els ossos d una gran au aquatica de mes de 3 milions d anys a caldes de malavella  ,0
1252,324.cat,14.0,2023-06-07T15:17:00.000Z,una noia va desapareixer el 2014 a torremolinos un home que havia sigut parella seva  despres de ser detingut per un crim masclista  ha confessat haver la matat i ha indicat on va amagar ne les restes,1
1253,324.cat,16.0,2023-06-07T15:10:00.000Z,la foto d un nen de ribes de freser de vacances a noruega  en un segell sense saber ho la mare va guanyar un concurs de l oficina de turisme i correus del pais   em pensava que era una estafa ,0
1254,324.cat,3.0,2023-06-07T14:57:00.000Z,tres hipotesis encara obertes sobre la destruccio de la presa de kakhovka  a ucraina  ,0
1255,324.cat,18.0,2023-06-07T14:50:00.000Z,el jutge ha aixecat el secret de sumari del cas que investiga monica oltra per suposat encobriment dels abusos sexuals del seu exmarit  i l informe policial dona la rao a l exvicepresidenta de la generalitat valenciana,0
1256,Esport3,8.0,2023-06-07T14:30:00.000Z, guillem balague ha assegurat en un article a la bbc que l argenti no jugara al barca la temporada que ve,0
1257,324.cat,1.0,2023-06-07T14:27:09.000Z,meritxell batet repetira com a candidata del psc a les eleccions del 23j  ,0
1258,324.cat,6.0,2023-06-07T14:09:00.000Z,les families d una escola de badajoz han empes el centre a suspendre una activitat per a infants de 10 anys que consistia a veure trossejar animals de caca i tastar los un cop cuinats,0
1259,324.cat,2.0,2023-06-07T14:06:00.000Z,l increment del preu de l habitatge es modera aquest primer trimestre del 2023  un periode en que la vivenda nova s ha encarit molt mes que la de segona ma,0
1260,324.cat,37.0,2023-06-07T13:59:00.000Z,arribar a final de mes s ha convertit en el principal maldecap per als millennials i la generacio z   el cost de la vida no para de pujar ,0
1261,324.cat,227.0,2023-06-07T13:51:00.000Z,consum investiga set aerolinies per fer pagar per l equipatge de ma i per triar seient  ,0
1262,324.cat,5.0,2023-06-07T13:43:59.000Z,el professor de karate de l esportiu claret  de 64 anys  va ser detingut al maig arran d una denuncia per agressio sexual ara  ja n acumula set,1
1263,324.cat,47.0,2023-06-07T13:25:00.000Z,la generalitat proposa pagar 90 euros a cadascun dels 13.581 opositors que es van presentar als caotics examens de finals d abril per cobrir 2.000 places publiques  i que s hauran de repetir,0
1264,324.cat,5.0,2023-06-07T13:20:00.000Z,malgrat que diversos avisos ho han anunciat al llarg del mati  la circulacio a la linia r3 no s ha restablert fins a dos quarts de tres  despres de 13 hores d interrupcio per la caiguda de la catenaria entre torello i manlleu,0
1265,324.cat,2.0,2023-06-07T13:10:00.000Z,cuba gooding jr ha arribat a un acord amb una dona que l acusava d haver la violat fa deu anys a l habitacio d un hotel a nova york i evita  aixi  anar a judici,0
1266,324.cat,50.0,2023-06-07T13:00:01.000Z,una nova alerta meteorologica avisara quan la calor dificulti el descans nocturn i pugui comportar un perill per a la salut  sobretot a la gent gran i a les persones vulnerables,0
1267,324.cat,7.0,2023-06-07T12:52:59.000Z,aixi han estat els examens de la selectivitat d angles  frances  alemany i italia  consulta n les preguntes i la correccio  pau23cat  ,0
1268,324.cat,4.0,2023-06-07T12:45:00.000Z, retruecano  la figura retorica que s han trobat els alumnes de la selectivitat a l examen de castella el sabries diferenciar de l oximoron o l hiperbaton  consulta totes les preguntes i la correccio  pau23cat,0
1269,324.cat,3.0,2023-06-07T12:33:18.000Z,els jesuites de catalunya encarreguen al despatx roca i junyent la investigacio dels abusos sexuals en els seus centres educatius i a una entitat de mediacio l atencio a les victimes,0
1270,324.cat,44.0,2023-06-07T12:18:52.000Z,renfe admet que no ha pogut restablir la circulacio a l r3 entre torello i manlleu per un problema amb la retirada d un tren avariat despres de la caiguda de la catenaria d aquest dimarts   ,0
1271,324.cat,17.0,2023-06-07T12:12:09.000Z,com un nen de ribes de freser es converteix en la imatge de turisme de noruega en un segell  ,0
1272,324.cat,9.0,2023-06-07T12:03:47.000Z,victoria de batman als tribunals europeus  el logo nomes el pot fer servir dc comics  ,0
1273,324.cat,87.0,2023-06-07T11:47:46.000Z, ultimahora llei del  nomes si es si  el suprem avala les rebaixes de penes a agressors sexuals  ,0
1274,324.cat,9.0,2023-06-07T11:42:00.000Z,els cientifics  en alerta davant un estudi que conclou que l artic es podria quedar sense gel mari a l estiu abans del previst   sera el primer element important del sistema climatic que perdem per culpa de les emissions de gasos d efecte hivernacle ,0
1275,324.cat,7.0,2023-06-07T11:36:51.000Z,monica oltra no va eliminar correus per encobrir l exmarit abusador  diu un informe policial  ,0
1276,324.cat,109.0,2023-06-07T11:08:00.000Z,una escola de badajoz tenia previst portar els alumnes de cinque i sise a veure trossejar un porc senglar  en una activitat per promocionar la carn de caca que ha acabat suspenent,0
