,UserName,RetweetCount,Timestamp,Text_clean,CriminalityRelated
1906,CatInfo Tgn-Ebre,5,2023-06-05T18:49:43.000Z,l eina erc i junts tanquen un acord i compartiran l alcaldia d altafulla  al tarragones volen que el pacte serveixi d exemple a la resta del pais per mostrar la unio de les forces independentistes   mes noticies territorials a   ,0
1907,CatInfo Girona,4,2023-06-05T18:35:00.000Z, l objectiu d un grup d amics jubilats d orriols  restaurar eines antigues de la pagesia o de les feines de la llar i les exposen al poble  a l alt emporda   a mes  fan una crida ,0
1908,Equip Viari,1,2023-06-05T18:20:25.000Z,de les 12h a  les 8 del vespre han tornat 234.000 dels 280.000 vehicles  que es preveu entrin avui a l area metropolitana de barcelona es tracta d un 84 per cent  del total  segons informa el sct  equipviari,0
1909,Catalunya Informació,1,2023-06-05T18:00:02.000Z, a catalunya  el 70 per cent  de la poblacio penitenciaria no ha acabat la formacio obligatoria les presons disposen de 9 escoles d adults per revertir aquesta mancanca,0
1910,Equip Viari,1,2023-06-05T17:32:20.000Z,de les 12h a un quart de 8 de la tarda han tornat 213.000 dels 280.000 vehicles  que es preveu entrin avui a l area metropolitana de barcelona es tracta d un 76 per cent  del total  segons informa el sct  equipviari,0
1911,Equip Viari,1,2023-06-05T17:09:53.000Z,10 km d embus a l ap 7 de banyeres del penedes a olerdola  nord  per un accident multiple amb diferents turismes implicats  ara un carril tallat  equipviari,0
1912,Catalunya Informació,,2023-06-05T17:30:00.000Z, front comu de manresa  berga i vic per visibilitzar l hemocromatosi  una malaltia que provoca un exces de ferro,0
1913,CatInfo Tgn-Ebre,2,2023-06-05T17:15:00.000Z,la creu roja repartira prop de 160.000 quilos d aliments a persones en situacio de vulnerabilitat a tarragona mes de 17.000 persones es beneficiaran del programa fead 2023 a la demarcacio   mes noticies territorials a   ,0
1914,Equip Viari,1,2023-06-05T16:29:23.000Z,cua a l ap 7 de castellet i la gornal a olerdola  nord per un accident  equipviari sct,0
1915,CatInfo Lleida,1,2023-06-05T16:57:04.000Z, descarreguen intensos ruixats  de forma aillada en diversos punts de la plana de  lleida   ha pedregat en alguns indrets com ara la zona de l aeroport de lleida alguaire  mes noticies   ,0
1916,CatInfo Tgn-Ebre,10,2023-06-05T16:45:36.000Z,l irta alerta que la reduccio de l aigua de reg al delta de l ebre fa creixer la mortalitat de les nacres de la badia dels alfacs   mes noticies territorials a   ,0
1917,Equip Viari,3,2023-06-05T16:27:26.000Z,de les 12h a un quart de 7 de la tarda han tornat 179.000 dels 280.000 vehicles  que es preveu entrin avui a l area metropolitana de barcelona es tracta d un 64 per cent  del total  segons informa el sct  equipviari,0
1918,CatInfo Lleida,4,2023-06-05T16:04:21.000Z,ha mort el nen que es va electrocutar el 28 de maig passat a torrefarrera  segria  juntament amb la seva mare  que va morir a l acte tots dos estaven netejant una piscina particular  l ajuntament ha decretat dos dies de dol oficial,0
1919,CatInfo Lleida,4,2023-06-05T16:14:23.000Z, la festa il legal prop del panta de santa anna continua en marxa amb unes 400 persones     mossos  mantenen controls als accessos a la rave i des de l ajuntament d ivars de noguera reclamen mes castig penal per als organitzadors   ,0
1920,Equip Viari,2,2023-06-05T15:56:49.000Z,encara   9 km de congestio ap 7 de viladasens a sant julia de ramis  barcelona tallada momentaniament es retira camio accidentat cua a la n ii de vilademuls a sant julia de ramis  barcelona  equipviari sct,0
1921,CatInfo Girona,2,2023-06-05T13:24:03.000Z,junts i independents tanquen un acord per governar a santa coloma de  farners    carme salamana  junts   que va guanyar els comicis  sera l alcaldessa  mes noticies a de girona a     ,0
1922,CatInfo Lleida,4,2023-06-05T11:23:33.000Z,dos policies locals d alcarras  segria  estan investigats per endur se material d una nau de torres de segre on hi havia marihuana  els agents diuen que la nau no estava precintada i que els objectes no tenien relacio amb l operacio antidroga,1
1923,CatInfo Lleida,1,2023-06-05T11:26:55.000Z, els pantans de la conca del segre  oliana i rialb  guanyen uns 30 hectometres des de finals d abril gracies a les pluges   les reserves  pero  encara no garanteixen la supervivencia dels arbres a la zona del canal d urgell i el segarra garrigues   ,0
1924,CatInfo Tgn-Ebre,3,2023-06-05T12:56:46.000Z,el judici contra quatre independentistes pels aldarulls post sentencia del proces a tarragona ha quedat suspes fins el dia 26  no ha comparegut un dels mossos citats,0
1925,Catalunya Informació,4,2023-06-05T14:45:00.000Z,els taxistes estan obligats a acceptar persones cegues que portin gos pigall  pero aixo no sempre passa,0
1926,CatInfo Girona,2,2023-06-05T12:26:19.000Z, junts per roses considera l acord amb el psc per formar govern un pacte de  persones i poble  a l acord tambe hi ha gent del poble   l actual alcalde d erc el considera un  desproposit  remarca que encara queda temps per reconduir el pacte   ,0
1927,Catalunya Informació,2,2023-06-05T12:28:11.000Z,els mossos d esquadra investiguen una agressio sexual grupal de diversos menors a una noia tambe menor d edat  dissabte a badalona  ,1
1928,Catalunya migdia,1,2023-06-05T12:00:02.000Z,ara al   catmigdia     creixen les emissions de gasos d efecte hivernacle a catalunya malgrat els acords de paris    sumar i podem negocien una coalicio contra rellotge    reunio joan laporta jorge messi a barcelona   ,0
1929,Nati Adell,3,2023-06-05T11:46:04.000Z,aquest cap de setmana s han fet  a porta tancada  les ultimes audicions per entrar al nou cor de veus mixtes de l   escolaniamonts  en total  s hi han presentat mig centenar de persones  el doble que places disponibles l estrena sera l 11 de setembre  montserrat,0
1930,CatInfo Tgn-Ebre,3,2023-06-05T11:00:02.000Z,tarragona s incorpora com a seu del festival de cinema lliure a la platja aquest juliol es projectaran les pel licules  alcarras   cinco lobitos  i  aftersun  des de la platja de la mora  mes noticies territorials a   ,0
1931,CatInfo Lleida,10,2023-06-05T11:01:10.000Z, cinc mossos ferits quan intentaven evitar una festa il legal a prop del panta de santa anna  a la noguera    la rave continua en marxa amb mes d un centenar de vehicles  la majoria estrangers,1
1932,Catalunya Informació,,2023-06-05T10:58:00.000Z,isc a les 13h el  catalunyaaldia amb   romagosamarta   destaquem  5 mossos ferits en aldarulls amb participants d una rave a la noguera  les ultimes pluges han fet baixar el risc d incendis forestals  albiol augmentara la seguretat al magic escolta ns aqui,0
1933,Jordi Baró Ruibal,1,2023-06-05T10:50:09.000Z,brussel les acusa twitter d optar per la confrontacio per abandonar el codi de bones practiques de la ue contra la desinformacio  i l avisa que examinara amb fermesa si compleix amb la nova llei europea de serveis digitals que entra en vigor el 25 d agost,0
1934,Jordi Baró Ruibal,4,2023-06-05T10:46:25.000Z,brussel les reclama a les plataformes d internet que etiquetin el contingut generat amb intel ligencia artificial  la comissio europea vol que la nova mesura  d entrada voluntaria i pensada per combatre la desinformacio  s apliqui de forma immediata,0
1935,Catalunya Informació,1,2023-06-05T10:27:25.000Z, ultimahora la comissio europea reclama que les plataformes d internet etiquetin el contingut generat amb intel ligencia artificial   ,0
1936,Catalunya Informació,17,2023-06-05T10:05:00.000Z,meloni ha destituit els principals carrecs de la rai i hi ha col locat al capdavant un simpatitzant de donald trump o vladimir putin periodistes historics de la cadena han dimitit perque no hi estan d acord,0
1937,CatInfo Girona,3,2023-06-05T10:03:24.000Z, localitzen  amb l us de drons  una gran plantacio de marihuana en un antic camping de figueres hi han comptat 5.350 plantes   la   guardiacivil  ha detingut dues persones que vivien en uns vestidors a la mateixa zona    ,0
1938,CatInfo Girona,3,2023-06-05T10:00:33.000Z, per primera vegada  els cellers de la   doemporda  han venut sis milions d ampolles de vi en un any  amb un augment d un 3 per cent    destaca l augment de vendes d un 3 4 per cent  a la resta de catalunya respecte del 2021. ara se situa en el 23 4 per cent     ,0
1939,CatInfo Girona,4,2023-06-05T09:11:34.000Z, restauren eines antigues de la pagesia o de les cases i les exposen al poble a mes  fan una crida per poder ne tenir mes   anem cap a orriols  a l alt emporda ,0
1940,Domènec Subirà,2,2023-06-05T07:54:23.000Z,detalls  a kosovo coexisteixen dues matricules  serbia i kosovar la serbia te els simbols tapats amb cinta va ser la solucio a un conflicte q va portar l exercit serbi a la frontera era una solucio temporal pero ja fa dos anys  ,0
1941,CatInfo Lleida,4,2023-06-05T07:52:42.000Z, la seu d urgell ja disposa d un espai dedicat al dol perinatal   l espai s ha construit en un raco del cementiri municipal  i s ha decorat amb textos del llibre  el petit princep    mes informacions de territori   ,0
1942,Catalunya Informació,,2023-06-05T07:50:00.000Z,escollir alcalde no va ser possible en 44 municipis de l estat perque no s hi va presentar cap candidatura   que passa en casos aixi ,0
1943,Catalunya Informació,1,2023-06-05T07:00:22.000Z, repassem el  mesllegitcr  com viu la comunitat musulmana de ripoll la victoria electoral de l extrema dreta,0
1944,Catalunya Informació,1,2023-06-05T07:02:55.000Z, el  mesllegitcr  els llibres arriben a tot arreu,0
1945,Catalunya Informació,1,2023-06-05T07:48:04.000Z, i acabem el repas amb la noticia que encapcala el ranquing del  mesllegitcr  cases de palla sense por del foc,0
1946,Catalunya Informació,58,2023-06-05T07:14:42.000Z, ultimahora almenys vuitanta nenes han estat enverinades en dues escoles de l afganistan   es el primer cop que hi ha un atac d aquest tipus al pais  des que els talibans van prendre el poder l estiu del 2021 i van restringir els drets de les dones   ,1
1947,Catalunya Informació,3,2023-06-05T06:37:58.000Z,  els joves  ni bojos volen treballar en aquest sector  diu un cambrer els sous i els horaris son poc atractius   a la construccio passa el mateix  la feina es dura i les jornades  s allarguen perque falta personal,0
1948,Catalunya Informació,1,2023-06-04T19:05:00.000Z, el dia en 4 paraules  un mal funcionament del sistema de senyalitzacio i gestio electronica de les vies seria la causa del xoc de trens de l india que ha deixat 275 morts  segons el govern indi tambe assegura que ja n han identificat els responsables,0
1949,Catalunya Informació,,2023-06-04T19:03:00.000Z, el dia en 4 paraules  el secretari general de l otan condemna els atacs a soldats de l alianca en les recents protestes a kosovo i demana a serbis i kosovars una desescalada dels enfrontaments i evitar actituds irresponsables,0
1950,Catalunya Informació,,2023-06-04T19:02:00.000Z, el dia en 4 paraules  la regio russa de belgorod s ha convertit en un dels fronts mes actius de la guerra  amb atacs atribuits a milicies de combatents russos contraries a la invasio d ucraina,0
1951,Catalunya Informació,,2023-06-04T19:00:01.000Z,el dia en 4 paraules  la fiscal de l audiencia de barcelona alexandra garcia tabernero reclama la creacio d una fiscalia especialitzada en violencies sexuals,0
1952,Catalunya Informació,1,2023-06-04T18:31:00.000Z, la monarquia ha contribuit a la desigualtat de la societat britanica  recorrem alguns indrets de londres per esbrinar per que es una de les ciutats mes desiguals del continent europeu escolta un nou capitol del podcast  mapamundi  ,0
1953,CatInfo Girona,1,2023-06-04T17:44:37.000Z,el psc de roses pacta amb junts i gent del poble per governar a l ajuntament i deixa fora els regidors d esquerra amb qui van governar l ultim mandat,0
1954,Catalunya Informació,1,2023-06-04T17:37:53.000Z,els paisos de l opep i 10 dels seus aliats  entre els quals russia  han acordat continuar retallant el subministrament de cru fins a finals de l any que ve ho han decidit durant la cimera celebrada avui a viena  a austria   ,0
1955,Catalunya Informació,1,2023-06-04T17:30:00.000Z, on abans hi dormien les vaques  ara hi ha un bosc de llibres   les llibreries de muntanya  un tresor cultural per al mon rural ,0
1956,Catalunya Informació,4,2023-06-04T17:15:00.000Z, dema fara 125 anys que va neixer federico garcia lorca quina relacio va tenir el poeta amb catalunya   ho explica   tonivall  a l arxivaho d aquesta setmana,0
1957,Catalunya Informació,,2023-06-04T17:05:00.000Z, cerveses  vins  caves i licors 0 0 per cent   cada cop n hi ha mes perque hi ha mes demanda  en parlem a  la teoria del cigne negre  ,0
1958,CatInfo Lleida,1,2023-06-04T16:20:00.000Z, llibreries de muntanya  cultura  d alcada  i de proximitat ,0
1959,Catalunya Informació,3,2023-06-04T15:45:00.000Z,l exercit ucraines reclama que s aturin les especulacions sobre cap possible contraatac als territoris ocupats per russia i demana silenci les forces armades han publicat un video en que diuen que no hi haura cap anunci de l inici de contraofensiva   ,0
1960,Catalunya Informació,1,2023-06-04T15:40:00.000Z,navarra concentra 37 dels 44 municipis de l estat on no s ha presentat cap candidatura que passa en aquests casos ,0
1961,Catalunya Informació,,2023-06-04T15:20:00.000Z,el canvi climatic facilita que hi hagi plagues tot l any  pero a l estiu sera pitjor,0
1962,Catalunya Informació,2,2023-06-04T14:58:00.000Z,un de cada 10 embarassos a l estat arriben per reproduccio assistida i catalunya es el lloc on se n fan mes els ultims mesos les llistes d espera a la sanitat publica s han reduit i estan en poc mes d un any avui es el dia mundial de la fertilitat   ,0
1963,Catalunya Informació,2,2023-06-04T14:45:00.000Z, el chemsex es una tendencia que consisteix en el consum sexualitzat de drogues,0
1964,CatInfo Girona,11,2023-06-04T09:11:00.000Z,la tradicio de les catifes de flors naturals reviu avui pels carrers d arbucies   han elaborat 30 catifes  una xifra que feia anys que no s assolia    ,0
1965,Catalunya Informació,6,2023-06-04T14:32:00.000Z,cada tres hores es denuncia una violacio a l estat  segons assegura la fiscal de l audiencia de barcelona,0
1966,Catalunya Informació,4,2023-06-04T14:00:01.000Z,meloni ha destituit els principals carrecs de la rai i hi ha col locat al capdavant giampaolo rossi  un personatge polemic per la seva simpatia cap a donald trump o vladimir putin periodistes historics de la cadena han dimitit perque no hi estan d acord,0
1967,CatInfo Lleida,1,2023-06-04T13:37:23.000Z,avui tanca a lleida el 42e aplec del caragol  en una edicio de record hi han participat 115 colles  8 mes que l any passat  formades per 14.500 persones l organitzacio calcula que hi han assistit uns 200.000 visitants   ,0
1968,Catalunya Informació,1,2023-06-04T13:15:00.000Z, hi ha un auge de l us de les cigarretes electroniques entre els adolescents de 14 a 18 anys,0
1969,Neus Bonet Bagant,1,2023-06-04T12:22:00.000Z,rosalia regna en l ultima nit del primavera sound a barcelona    catalunyamigdiacapdesetmana,0
1970,Neus Bonet Bagant,4,2023-06-04T12:16:00.000Z,pequin ha prohibit tota commemoracio de la matanca a la placa de tiananmen  avui fa 34 anys   catalunyamigdiacapdesetmana,0
1971,Neus Bonet Bagant,1,2023-06-04T12:15:00.000Z,a kosovo  la tensio no s atura i la unio europea amenaca amb consequencies negatives si no s acaba amb els incidents   catalunyamigdiacapdesetmana,0
1972,Neus Bonet Bagant,1,2023-06-04T12:08:00.000Z,consternacio a oia  a pontevendra  per l assassinat d una dona a mans de la seva exparella   catalunyamigdiacapdesetmana,0
1973,Neus Bonet Bagant,2,2023-06-04T12:00:00.000Z,una fiscalia especialitzada en violencia sexual   ho reclama  des de catalunya radio  la fiscal de l audiencia de barcelona  alexandra garcia tabernero  comenem el  catalunyaradiocapdesetmana,0
1974,Catalunya Informació,1,2023-06-04T11:51:00.000Z, les llibreries de muntanya  cultura rural de proximitat   llegeix l article aqui ,0
1975,CatInfo Barcelona i Catalunya Central,3,2023-06-04T11:39:08.000Z,el banc dels aliments recapta 116.000 quilos de productes en dos dies a les comarques de barcelona la campanya  operacio quilo  ha servit per recollir aliments per a les entitats socials que s havien quedat sense a causa de l augment dels preus   ,0
1976,Catalunya Informació,4,2023-06-04T11:04:53.000Z,front comu de manresa  berga i vic per visibilitzar l hemocromatosi  una malaltia que provoca un exces de ferro,0
1977,CatInfo Girona,3,2023-06-04T09:35:00.000Z, la policia local de platja d aro sancionara qui vagi a la cala belladona amb el gos nomes en casos reiterats    s han fet enrere en aquests usos per problemes administratius i asseguren que  primer de tot  s optara per informar els usuaris,0
1978,Catalunya Informació,1,2023-06-04T10:14:56.000Z,els paisos de l opep i els seus aliats  entre els quals hi ha russia  es reuneixen avui per decidir el nivell de produccio de petroli pels proxims mesos si redueixen la produccio de cru aixo suposaria la tercera retallada des del mes d octubre passat   ,0
1979,Catalunya Informació,,2023-06-04T09:50:45.000Z,dels mes de 2 milions de tones de residus plastics que es generen a espanya cada any  nomes se n reciclen la meitat,0
1980,Catalunya Informació,,2023-06-04T09:30:58.000Z,per llei  els taxistes estan obligats a acceptar gossos pigall  pero no tots ho fan,0
1981,CatInfo Lleida,1,2023-06-04T09:10:00.000Z, neix  la traca cultural  una plataforma pensada per a connectar la cultura pirinenca    ho expliquem aqui   ,0
1982,Catalunya Informació,1,2023-06-04T09:05:00.000Z, ja es possible demanar la baixa per menstruacio incapacitant  t expliquem com es pot fer,0
1983,Catalunya Informació,,2023-06-04T08:58:40.000Z,diumenge passat  en 44 municipis de l estat no van poder escollir alcalde perque no s hi va presentar ningu,0
1984,CatInfo Girona,7,2023-06-04T08:22:00.000Z, els museus municipals de girona es poden visitar gratuitament el primer diumenge de mes al mati    heu estat al   museucinema   celebra 25 anys oferint un recorregut per 400 anys de somnis  aqui en teniu un tast,0
1985,CatInfo Tgn-Ebre,3,2023-06-04T07:00:01.000Z, la sequera incrementa la contractacio de saurins per trobar aigua la comunitat cientifica els tracta d estafadors els saurins defensen la seva activitat estafadors o salvadors   us ho expliquem,0
1986,CatInfo Girona,1,2023-06-04T07:05:00.000Z, com potenciar el relleu generacional a la pesca  un curs a palamos ofereix als alumnes ser aprenents de manera remunerada   ,0
1987,CatInfo Girona,2,2023-06-04T06:10:00.000Z, avui hi ha la fira mercat de la cirera de terrades  a l alt emporda   tot i que els agricultors estan preocupats per la plaga de la mosca suzuki i la sequera  remarquen que la fira se celebra amb tota normalitat  mes temes a  ,0
1988,CatInfo Girona,2,2023-06-04T06:22:00.000Z, a   uniopagesos  dubten dels 5.400 senglars morts en vuit mesos a rocacorba i les gavarres anunciats per   accioclimatica  demanen mes batudes  mes trampes i que es deixi als pagesos cacar on hi ha massa animals,0
1989,Catalunya Informació,1,2023-06-04T08:06:14.000Z,repassem el  mesllegitcr  una xarxa que connecta la cultura del pirineu,0
1990,Catalunya Informació,1,2023-06-04T08:07:23.000Z,el  mesllegitcr  viure en una casa de palla,0
1991,Catalunya Informació,1,2023-06-04T08:09:25.000Z,i acabem el repas amb la noticia que encapcala el ranquing del  mesllegitcr  la situacio politica a ripoll despres de les municipals,0
1992,Catalunya Informació,1,2023-06-04T08:06:00.000Z,  catalineta  i  filetdor  noms basats en una rondalla popular balear  serviran per anomenar una estrella i el planeta que l orbita a la constel lacio d hydra ,0
1993,Catalunya Informació,,2023-06-04T07:20:00.000Z, presentacions literaries  col loquis i recitals en pobles rurals    les llibreries de muntanya dinamitzen la vida cultural als pobles del pirineu    en parlem aqui   ,0
1994,Catalunya Informació,,2023-06-04T07:05:00.000Z,  l escassetat d aigua ha fet caure la produccio a les plantacions de marihuana que son a l aire lliure i  en canvi  ha fet creixer les petites produccions interiors,0
1995,Marc Ruiz,4,2023-06-03T23:16:28.000Z,ja son tota una icona pitchfork va destrossar el disc de  maneskin  pero tenen un directe potentissim  atractiu  divertit i que pot ser l emveja de qualsevol i quan canten en italia ho rebenten tot bravi   ps23,0
1996,Marc Ruiz,3,2023-06-04T00:14:46.000Z,i   rosalia  torna al   primavera_sound  amb saoko surt a l escenari  es treu el casc de motomami i els cabells lo volen al vent angular i contrapicat reina reina ,0
1997,Marc Ruiz,2,2023-06-04T00:19:44.000Z,explica rosalia que mentre veia grace jones al primavera el 2017  somiava ser cap de cartell algun dia i avui ha acomplert el somni,0
1998,Catalunya Informació,3,2023-06-03T21:10:00.000Z,  durant 15 anys  aqui no hi havia cap llibreria ara n hem obert una i tenim una gran resposta    les llibreries rurals  un motor d activitat cultural als pobles ,0
1999,Catalunya Informació,2,2023-06-03T19:05:00.000Z,el dia en 4 paraules  dels mes de 2 milions de tones de residus plastics que es generen a espanya cada any  nomes se n reciclen la meitat malgrat tot  l estat espanyol es el segon pais d europa  nomes per darrere d alemanya  amb mes plastic reciclat,0
2000,Catalunya Informació,,2023-06-03T19:04:00.000Z,el dia en 4 paraules  la ue adverteix que aplicara mesures si no es restableix la calma despres dels actes de violencia al nord de kosovo els serbis boicotegen els alcaldes albanokosovars perque no els consideren legitimats,0
2001,Catalunya Informació,13,2023-06-03T19:02:00.000Z,el dia en 4 paraules  destituits els principals carrecs de la radio i la televisio publiques d italia per odre de giorgia meloni la primera ministra ha substituit el director general de la rai per un d afi,0
2002,Catalunya Informació,1,2023-06-03T19:00:01.000Z,el dia en 4 paraules  les direccions d erc i de junts es reuneixen a ginebra per analitzar els resultats de les eleccions municipals i veure com plantegen l eleccio d alcaldes el 17 de juny  quan s han de constituir els ajuntaments,0
2003,Catalunya Informació,1,2023-06-03T18:05:00.000Z, cada any a la nasa li arriben uns 800 avistaments  pero assegura que la majoria tenen explicacions senzilles,0
2004,Catalunya Informació,,2023-06-03T18:02:19.000Z,el president dels estats units valida l acord per elevar el sostre del deute public dels estats units  que en paraules seves ha salvat el pais d una catastrofe  l acord inclou limits de despesa en ambits com la sanitat  l educacio o el medi ambient   ,0
2005,Marc Ruiz,1,2023-06-03T17:15:50.000Z,fent terapia amb arlo parks les cures  la salut mental i la soledat son alguns dels temes principals de les seves cancons que  com caroline  t atrapen en un corrent emocional i ja no et deixen   primavera_sound,0
2006,Oscar Callau,2,2023-06-03T17:46:44.000Z,arlo parks  veu de la  super sad generation  escalfa el   primavera_sound  amb la seva veu calida i cancons de pop amb tocs de jazz  soul   funky o trip hop la britanica  de nom real anais oluwatoyin  presenta el disc  my soft machine  orfebreria melodica i lletres intimistes,0
2007,Catalunya Informació,,2023-06-03T17:26:05.000Z,els envasos multicapes o el film son materials molt dificils de reciclar el repte es substituir los per alternatives mes sostenibles,0
2008,Catalunya Informació,1,2023-06-03T16:54:33.000Z,44 localitats de tot l estat no tenen alcalde perque ningu no es va voler presentar a les eleccions,0
2009,Catalunya Informació,50,2023-06-03T16:19:18.000Z,destituits els principals carrecs de la radio i la televisio publiques d italia per odre de la primera ministra giorgia meloni ha nomenat nou director de la rai un simpatitzant de les tesis de donald trump o vladimir putin,0
2010,CatInfo Girona,3,2023-06-03T16:04:00.000Z,l onzena edicio del festival internacional de magia de torroella de montgri   fimagmagia  ofereix fins diumenge 70 espectacles en 11 espais diferents    la majoria son gratuits al carrer i en espais singulars    avui hi ha la gran gala internacional   ,0
2011,Catalunya Informació,2,2023-06-03T16:03:00.000Z, la unio astronomica internacional ha escollit una proposta de les illes balears per designar el sistema planetari wasp 166 amb dos noms extrets de la cultura tradicional de mallorca ,0
2012,Oscar Callau,1,2023-06-03T15:07:23.000Z,comenca la roda de premsa de balanc del   primavera_sound  2023. alfonso lanza  director del festival   amb els canvis de disposicio  hem aconseguit una edicio molt comoda perque ara el festival es mes compacte i les distancies mes curtes ,0
2013,Oscar Callau,1,2023-06-03T15:10:47.000Z, l unic incident va ser ahir a la nit amb el petit incendi que va fer interrompre l actuacio d skrillex  pero l equip de seguretat va poder controlar ho de seguida ,0
2014,Oscar Callau,1,2023-06-03T15:15:21.000Z, en total hem tingut 253.000 assistents  193.000 dels quals al recinte del forum  65.000 de mitjana diaria  el 52 per cent  de public  internacional l any que ve tornem a barcelona del 30 de maig a 1 de juny ara el repte mes immediat es l edicio de madrid ,0
2015,Oscar Callau,1,2023-06-03T15:20:04.000Z, no ens preocupa no haver arribat al sold out el recinte te cabuda per a 80.000 persones pero ja haviem calculat atendre la xifra de 65.000 de mitjana  70.000 avui dissabte  per a un bon funcionament del festival ,0
2016,Oscar Callau,1,2023-06-03T15:23:20.000Z, a madrid el format ens permetria acollir 50.000 persones  pero esperem de mitjana tenir ne cada dia 40.000. l efecte crida dels bons comentaris del cartell vist a barcelona podria fer augmentar una mica les previsions  ,0
