,UserName,RetweetCount,Timestamp,Text_clean,CriminalityRelated
533,Mossos,6,2023-03-31T14:22:06.000Z,tothom ha de contribuir a la seguretat a la carretera respecta la senyalitzacio i el limit de velocitat i  en vies rapides  circula pel carril de la dreta el de l esquerra o el del mig  utilitza l nomes per avancar  volemquetornis,0
534,Mossos,4,2023-03-31T11:01:29.000Z,en el marc del  platremall hem fet patrullatges a l entorn d aquest local i hem realitzat dos dispositius contra el trafic de drogues ja que les persones que hi vivien l utilitzaven com a punt de venda,0
535,Mossos,85,2023-03-31T11:00:51.000Z,desactivem a barcelona per ordre judicial un local ocupat per multireincidents al poble sec  hi havia 19 persones amb 125 antecedents son lladres especialitzats en furts i robatoris violents retornem el local al seu propietari per evitar noves ocupacions  platremall,1
536,Mossos,5,2023-03-31T09:09:54.000Z,ens hem encarregat de realitzar els talls viaris necessaris per garantir la seguretat de l operatiu que participava en la resolucio de l emergencia,0
537,Mossos,18,2023-03-31T05:57:45.000Z,desarticulem a barcelona un grup criminal especialitzat en furts i robatoris violents integrat per deu persones amb un centenar d antecedents des de l estiu del 2022  platremall  ,1
538,Mossos,3,2023-03-31T06:00:41.000Z,estan relacionats amb una cinquantena de furts i robatoris denunciats des de fa uns mesos a barcelona pero atesa la seva elevada activitat delictiva no es descarta la seva participacio amb molts mes fets,0
539,Mossos,3,2023-03-31T06:00:41.000Z,a barcelona  tenim activat el  platremall de lluita contra la multireincidencia durant els mesos de gener i febrer s han destinat 27.000 hores en patrullatges i dispositius relacionats amb aquest ambit,0
540,Mossos,4,2023-03-31T05:23:45.000Z,avui es el dia internacional de la visibilitat transgenere viure amb la identitat de genere amb la qual s identifiquen es un dret de tothom posem fi a l odi i a la intolerancia  visibilitattrans  stopdelictesodi,0
541,Mossos,18,2023-03-30T18:55:47.000Z,avui la unitat canina  amb motiu del 1r aniversari de la inauguracio del monolit  ha fet un homenatge al foster  el hulk  el tango i l unkas  els gossos policies morts enguany gracies  companys canins  per la vostra entrega i predisposicio  sempre al servei de la ciutadania,0
542,Mossos,2,2023-03-30T17:30:29.000Z,membres de la unitat de drons van participar a la jornada anual de la dca drons 2023 a l escola d enginyeria de telecomunicacio i aeroespacial de la universitat politecnica de catalunya de castelldefels  amb la ponencia  la integracio de la tecnologia dron a la pg me ,0
543,Mossos,14,2023-03-30T17:30:17.000Z,detenim 3 homes a girona per robar dins de dos domicilis  poques hores mes tard  en detenim 2 mes per un robatori en un establiment i un sise lladre per un altre robatori dins d un pis total 6 detinguts en poques hores  tots ells per delictes contra el patrimoni,1
544,Mossos,21,2023-03-30T16:30:30.000Z,denunciem penalment un home a l alt camp per conduir una moto amb la seva filla recolzada al manillar  sense casc i fumant mentre ho enregistrava amb el mobil a mes l acompanyava un altre fill menor  tambe en moto i sense casc  que no disposava de permis de conduccio,0
545,Mossos,7,2023-03-30T13:55:28.000Z,ingressa a preso un home que hem detingut a reus per estafa  amenaces i compres fraudulentes es va apropiar de mes de 300.000 euros en joies i diners fent se passar per treballador de dues entitats bancaries,1
546,Mossos,21,2023-03-30T10:33:11.000Z,fer us de dades personals sostretes aixi com facilitar qualsevol enllac per accedir hi pot ser delicte mantenim oberta la investigacio conjunta amb   ciberseguracat  sobre el ciberatac de fa unes setmanes contra l   hospitalclinic,0
547,Mossos,6,2023-03-30T09:30:39.000Z,desmantellem amb   gubbarcelona  un punt de venda i consum de drogues al barri gotic  balanc   1 detingut  intervenim crack  diners en efectiu 1 bascula de precisio i estris per a la manipulacio  propietat recuperada,1
548,Mossos,8,2023-03-30T07:54:41.000Z,desmantellem una plantacio de marihuana en una casa de palau saverdera  alt emporda intervenim 1.819 plantes en avancat estat de floracio i detenim quatre persones per un delicte contra la salut publica i frau electric,1
549,Mossos,12,2023-03-30T05:59:37.000Z,desarticulem un grup criminal especialitzat en el robatori de carregues de camions estacionats en arees de servei a  l ap 7. actuaven de nit quan els camioners dormien i en alguns casos empraven violencia i intimidacio  ,1
550,Mossos,12,2023-03-29T16:19:21.000Z,un testimoni truca al   112  i ens informa que estan forcant la persiana d un local a mataro quan arribem  localitzem una plantacio de marihuana i detenim un home de 36 anys que la custodiava,1
551,Mossos,9,2023-03-29T13:11:03.000Z,s ha publicat la llista definitiva de persones convocades a la 1a prova d acces al cos la consulta personalitzada la podeu fer al seguent enllac     ensfaltestu,0
552,Mossos,11,2023-03-29T10:16:45.000Z,detenim quatre homes al tarragones per un cas d extorsio la victima  sota amenaces i coaccions  va pagar 6.000 euros als detinguts,1
553,Mossos,5,2023-03-29T08:12:11.000Z,la caporala de la unitat d igualtat i equitat de mossos explica com estem aplicant les politiques d igualtat al cos d acord amb la normativa vigent,0
554,Mossos,10,2023-03-29T07:01:46.000Z,per protegir la teva empresa d un atac de  ransomware segueix aquests consells   tingues un sistema de copies de seguretat fora de linia  consciencia els treballadors dels riscos del ransomware  disposa d un pla de continuitat en cas d incident greu  ciberseguracat,0
555,Mossos,15,2023-03-28T14:46:45.000Z,desmantellem conjuntament amb   scgramenet  un domicili que funcionava com a punt d entrada de substancies a catalunya intervenim uns 15 quilograms de haixix i mes de 5.000 euros en efectiu,1
556,Mossos,10,2023-03-28T11:25:03.000Z,desmantellem amb   ajuntcalonge  una plantacio de marihuana en una casa ocupada intervenim 852 plantes i detenim dos homes com a responsables del cultiu,1
557,Mossos,13,2023-03-28T09:26:48.000Z,desmantellem amb   gubbarcelona  un punt de venda i consum de drogues a ciutat vella balanc   5 detinguts  crack i marihuana  bascules i estris de manipulacio   propietat recuperada,1
558,Mossos,11,2023-03-28T06:17:40.000Z,no et sentis culpable si pateixes una agressio sexual l unic responsable es l agressor  tu ets la victima i la nostra prioritat es assistir te i ajudar te  sialconsentiment,0
559,Mossos,7,2023-03-27T18:51:29.000Z,ha finalitzat la   voltacatalunya  i ens acomiadem del pilot fins la propera edicio amb les millors imatges de la setmana gracies a tots els serveis d emergencia que han participat i als espectadors i usuaris de les vies afectades,0
560,Mossos,8,2023-03-27T16:32:21.000Z,  la meva principal motivacio es ajudar els companys i companyes a que a l hora de fer les seves intervencions puguin estar mes segurs  explica l arantxa  caporala del cos de mossos d esquadra,0
561,Mossos,23,2023-03-27T14:21:37.000Z,ingressa a preso un home per vendre cocaina a la zona del mercat municipal de blanes traficava amb un altre home a qui tambe vam detenir en l entrada i escorcoll en els seus domicilis intervenim cocaina  diners en efectiu i estris necessaris per al trafic de droga,1
562,Mossos,33,2023-03-27T11:03:34.000Z,des de divendres i fins diumenge en el marc del  platremall detenim a barcelona 23 lladres per robatoris violents al carrer de mobils i bosses de ma van actuar al centre de la ciutat i a la platja en alguns casos  la col laboracio ciutadana va ser clau sumen 135 antecedents,1
563,Mossos,43,2023-03-27T09:28:07.000Z,el hacker pot entrar a l ordinador de la teva organitzacio per diverses vies  per correu electronic  atacant les contrasenyes o explotant vulnerabilitats del maquinari o del programari si has estat victima contacta amb catalonia cert de   ciberseguracat  al 900 112 444 i denuncia,0
564,Mossos,12,2023-03-27T06:23:14.000Z,detenim els tres autors d un homicidi per una revenja entre grups criminals francesos a salou el mes de maig de 2022. la investigacio tutelada per   eurojust  ha permes que els fets  tot i que van succeir a catalunya  es jutgin a franca  ,1
565,Mossos,10,2023-03-26T18:47:56.000Z,quan facis gestions digitals amb el banc    no comparteixis les teves contrasenyes ni codis de seguretat  verifica abans de fer clic o respondre trucades o missatges sospitosos  manten els teus dispositius i apps actualizades   stopestafes,0
566,Mossos,5,2023-03-26T16:41:24.000Z,busques allotjament turistic per  setmanasanta  fes ho a traves de plataformes de confianca i evita pagaments fora del seu portal perque podria ser una estafa   internetambseny   stopfraudigital,0
567,Mossos,12,2023-03-26T14:02:23.000Z,comencem el dispositiu de seguretat per la final four de la   kingsleague  hi participem amb diferents unitats per tal que l esdeveniment es desenvolupi sense incidencies i en un ambient festiu i ludic,0
568,Mossos,5,2023-03-26T10:15:51.000Z,ultima etapa de la   voltacatalunya  amb inici i final a barcelona finalitzen 7 dies de recorregut en que els agents desplegats per tots els seveis d emergencia han garantit que la prova hagi transcorregut sense incidents  ,0
569,Mossos,11,2023-03-26T09:26:04.000Z,si vas a la final four de la   kingsleague  al camp nou  recorda que esta catalogada com a un esdeveniment esportiu i hi haura coses que no podras entrar al camp ,0
570,Mossos,26,2023-03-26T08:15:10.000Z,es fa passar per multimilionari i estafa 300.000 eur a propietaris de xalets  pisos d alt nivell i hotels de luxe de barcelona on s hi instal lava feia transferencies falses i el detenim dos cops en un mes  ,1
571,Mossos,8,2023-03-25T21:45:04.000Z,recorda  avui entrem a l horari d estiu  haurem d avancar una hora els rellotges  quan les busques marquin les dues de la matinada seran les tres,0
572,Mossos,17,2023-03-25T19:54:34.000Z,el coordinador de seguretat es el comandament de mossos d esquadra que supervisa i coordina tots els elements de seguretat d un esdeveniment esportiu  cesabadell   fcbarcelonab,0
573,Mossos,205,2023-03-25T17:03:36.000Z, tornen els estafadors que suplanten bancs com el   bbva  no facis cas d aquest sms  esborra l i sobretot no segueixis l enllac ni donis dades personals  stopfraudigital,0
574,Mossos,18,2023-03-25T15:09:05.000Z,en una relacio tens dret a posar limit quan tu vulguis l altra persona ha de respectar la teva voluntat en tot moment si dius prou  es prou  sialconsentiment,0
575,Mossos,4,2023-03-25T12:10:41.000Z,jornades finals de la   voltacatalunya  amb la 6a etapa entre martorell i molins de rei que ens deixa a les portes de barcelona  estigueu atents a les banderes dels motoristes  seguiu les instruccions dels agents  gaudiu de l espectacle amb respecte  ,0
576,Mossos,28,2023-03-25T09:04:01.000Z,desarticulem amb   guardiacivil  una organitzacio criminal que introduia haixix a catalunya des del marroc amb llanxes rapides intervenim mes de 3 tones de droga i detenim 13 persones 6 han ingressat a preso provisional  ,1
577,Mossos,8,2023-03-24T20:20:02.000Z,amb aquests consells d   internetambseny  podras detectar intents d estafa quan intentis reservar un allotjament turistic sigues prudent abans de fer qualsevol pagament o donar les teves dades i si has estat victima denuncia ho a una comissaria,0
578,Mossos,36,2023-03-24T19:19:41.000Z,denunciem un camio a la c 25 al bages per 6 infraccions   revisio tacograf caducada sense document de control sense itv exces d hores de conduccio no descansar el temps obligatori sense carnet per perdua de punts,0
579,Mossos,6,2023-03-24T18:18:02.000Z,treballem en aquest accident amb un camio bolcat que ocupa els dos carrils de circulacio tallem preventivament l acces a arbucies des de la c 25 i recomanem com a ruta alternativa accedir hi des d hostalric,0
580,Mossos,4,2023-03-24T17:16:54.000Z,enhorabona  david i   radioigualada   pel reconeixement de   radioassociacio  a la feina ben feta moltes gracies per haver nos convidat a participar al  comhoveus va ser una gran experiencia compartir aquest moment amb vosaltres,0
581,Mossos,8,2023-03-24T16:08:33.000Z,detenim un home a figueres per robar gasoil i saltar se quatre ordres judicials de prohibicio d aproximar se a la mateixa empresa,1
582,Mossos,2,2023-03-24T14:40:00.000Z,la 5a etapa de la   voltacatalunya  transcorre per terres de l ebre la prova entra en els ultims dies en els quals nosaltres hem estat presents per garantir que es fes amb seguretat tant de corredors com de la resta d usuaris de la via recorregut d avui   ,0
583,Mossos,11,2023-03-24T12:04:39.000Z,la intel ligencia policial permet detenir dues persones a la garriga en el marc del dispositiu oikos de prevencio de robatoris amb forca a interior de domicili de la zona del valles els dos detinguts han ingressat a preso  ,1
584,Mossos,6,2023-03-24T09:25:48.000Z,a catalunya  seguretat en cos i anima comptem amb un equip que no para de creixer mes de 30.000 professionals al teu costat,0
585,Mossos,7,2023-03-24T06:56:23.000Z,activem un dispositiu de seguretat per a la final four de la   kingsleague  coordinadament amb el departament de seguretat del   fcbarcelona_cat  la   gubbarcelona  treballara per garantir la mobilitat als entorns de l estadi   ,0
586,Mossos,,2023-03-24T06:56:39.000Z,aquesta competicio esta catalogada com a un esdeveniment esportiu es prohibira l acces de begudes alcoholiques  ampolles d aigua i objectes voluminosos tambe es restringira l acces de cascos de motos com ja es habitual en partits que es disputen al camp,0
587,Mossos,,2023-03-24T06:56:54.000Z,hi participem amb diferents unitats per garantir la seguretat ciutadana i ordre public  permetre l entrada sense incidencies i evitar l accio de lladres multireincidents que aprofiten les grans aglomeracions per actuar tambe s activara la unitat de drons,0
588,Mossos,6,2023-03-23T20:09:37.000Z,les opinions sobre l amfitrio ens poden alertar de si un anunci d un allotjament turistic es una estafa llegeix les atentament i en cas de dubte ignora l oferta   internetambseny   stopfraudigital,0
589,Mossos,28,2023-03-23T18:51:00.000Z,detenim un home en relacio amb la mort violenta d una dona a mora la nova  ribera d ebre ,1
590,Mossos,27,2023-03-23T17:49:53.000Z,ens avisen d un abocament il legal de residus a calonge de segarra  anoia  l inspeccionem i esbrinem que prove d un pis de calaf en obres li fem retirar els residus i els deixa a tora  denunciem els 3 responsables per gestio incorrecta de residus,0
591,Mossos,10,2023-03-23T16:39:07.000Z,desmantellem una plantacio de marihuana en una nau ocupada de la zona agricola de cabrera de mar intervenim 640 plantes en fase de creixement,1
592,Mossos,13,2023-03-23T14:11:26.000Z,no deixis entrar desconeguts a la finca comunitaria i assegura t que la porta d entrada a l edicifi quedi ben tancada quan entris i surtis  llarsegura,0
593,Mossos,3,2023-03-23T12:05:35.000Z,en marxa la 4a etapa de la   voltacatalunya  entre llivia i sabadell ens trobaras al llarg de tot el recorregut per facilitar el pas del pilot ciclista i evitar accidents pots consultar el recorregut a   per planificar els teus trajectes,0
594,Mossos,14,2023-03-23T09:40:12.000Z,investiguem la mort violenta d una dona a mora la nova  ribera d ebre   ,1
595,Mossos,9,2023-03-23T08:32:20.000Z,en cas de desaparicio  les primeres hores son les mes importants denuncia al mes aviat possible,0
596,Mossos,8,2023-03-23T07:26:50.000Z,desarticulem amb la policia de lille una organitzacio criminal internacional que va exportar mes d una tona de marihuana a franca amagada en palets que contenien recanvis de vehicle detenim 13 persones i intervenim 260kg de marihuana i 60kg de haixix  ,1
597,Mossos,21,2023-03-22T20:06:48.000Z,detectem un vehicle que fuig d un control policial a la carretera n 260  a ribes de freser  en fem el seguiment fins a alp on els dos ocupants acaben detinguts al cotxe hi portaven 22 quilos de marihuana tots dos ja han ingressat a preso,1
598,Mossos,15,2023-03-22T16:53:51.000Z,detenim dos homes a blanes que havien forcat els accessos d una perruqueria per robar hi la col laboracio ciutadana va ser clau per detenir els lladres  el primer d ells al mateix lloc dels fets i l altre moments mes tard quan volia fugir per la platja,1
599,Mossos,2,2023-03-22T14:44:27.000Z,arriba la  setmanasanta i les ofertes poden venir amb una estafa amagada segueix aquests consells per detectar les,0
600,Mossos,3,2023-03-22T12:55:41.000Z,3a etapa de la   voltacatalunya  entre olost i la molina continuem acompanyant la comitiva per garantir la seguretat de la prova segueix les indicacions de les banderes que porten els nostres motoristes i les dels agents desplegats als diferents punts  ,0
601,Mossos,15,2023-03-22T11:07:06.000Z,desmantellem amb   gubbarcelona  tres punts de venda i consum de drogues a ciutatvella que generaven moltes molesties veinals  balanc  5 detinguts  intervenim crack  heroina i cocaina  balances de precisio  diners en efectiu  2 propietats recuperades,1
602,Mossos,11,2023-03-22T08:33:13.000Z,podeu visitar l exposicio crims al palau robert  on mostrem recursos per investigar delictes  fins al 10 d abril,0
603,Mossos,5,2023-03-22T08:18:14.000Z,activats diversos indicatius que s han desplacat al lloc dels fets obrim investigacio per esclarir les causes d aquest incendi a rubi,0
604,Mossos,42,2023-03-22T06:47:20.000Z,l assetjament escolar es una xacra que fa molt mal a les victimes que el pateixen si n ets testimoni  no hi participis  defensa la victima i informa n al professorat i o pares  posicionat  stopbullying,0
605,Mossos,14,2023-03-21T20:06:06.000Z,detenim un home presumptament relacionat amb una mort violenta aquesta tarda a valls  ,1
606,Mossos,72,2023-03-21T19:46:12.000Z,detenim per homicidi imprudent el conductor drogat d un tot terreny implicat en un accident mortal a sitges,1
607,Mossos,74,2023-03-21T18:57:52.000Z,un agent fora de servei veu dues dones en el parquing d un supermercat d igualada amb actitud sospitosa quan arribem  una d elles esta regirant un vehicle li localitzem un inhibidor de frequencia que usava per inutilitzar el tancament del vehicle les detenim per 3 robatoris,1
608,Mossos,16,2023-03-21T17:34:27.000Z,detenim tres homes a girona quan acabaven de furtar la carrega d un camio fugen a gran velocitat amb un cotxe amb les plaques de matricula tapades recuperem tot el boti  263 capses de cafe,1
609,Mossos,6,2023-03-21T15:57:44.000Z,la nostra app es una aplicacio molt intuitiva on hi ha els serveis policials disponibles  com ara trobar la teva comissaria mes propera ho expliquem al   popapcatradio  a   catalunyaradio,0
610,Mossos,14,2023-03-21T13:00:49.000Z,estrenem nou decret d estructura que reemplaca el decret vigent de l any 2011 i adapta el cos a les noves necessitats de seguretat publica i consolida el model de policia de proximitat  ,0
611,Mossos,2,2023-03-21T13:02:17.000Z,es crea la nova regio policial virtual que dura a terme funcions de policia comunitaria en l entorn virtual  mitjancant sistemes d interrelacio no presencials amb la ciutadania  aixi com de prevencio i persecucio d il licits en entorns virtuals,0
612,Mossos,1,2023-03-21T13:02:38.000Z,la divisio d investigacio criminal es diferenciara en dues divisions  la territorial i central s apostara per la lluita contra el cibercrim  les violencies sexuals i la corrupcio amb la creacio d arees centrals especifiques,0
613,Mossos,12,2023-03-21T10:44:12.000Z,2a etapa de la   voltacatalunya  entre mataro i vallter amb punts de pas principals per sant celoni  hostalric  angles  olot i  camprodon pots consultar el recorregut per comprovar si afecta els teus desplacametns d avui   ,0
614,Mossos,4,2023-03-21T07:59:30.000Z,al 2022 vam rebre 641 denuncies relacionades amb odi i discriminacio  de les quals 227 ho eren per motius d origen racial o nacional  en el dia internacional per a l eliminaciodiscriminacioracial  recordem que cal denunciar qualsevol actitud discriminatoria  stopdelictesodi,0
615,Mossos,9,2023-03-20T19:51:46.000Z,nosaltres ja tenim la samarreta i estem preparats per a la caminada solidaria   camialteucostat   i tu   vine a participar hi    data  29 d abril  inscripcio  3 eur  samarreta  12 eur  trobaras tota la informacio a   ,0
616,Mossos,18,2023-03-20T17:41:22.000Z,quan surtis de casa  encara que sigui un moment  tanca tots els accessos i no deixis entrar desconeguts a la zona comunitaria  llarsegura,0
617,Mossos,20,2023-03-20T15:23:03.000Z,detenim un home per robar en un celler productor de vi a torrent  baix emporda  recuperem el material sostret  ampolles de vi  la caixa registradora i diners en efectiu,1
618,Mossos,15,2023-03-20T12:23:57.000Z,ha comencat la 102a edicio de la   voltacatalunya   1a etapa amb inici i final a sant feliu de guixols estigueu atents a les instruccions que us donin els agents desplegats per garantir la seguretat de la prova podeu consultar el recorregur   ,0
619,Mossos,29,2023-03-20T11:11:49.000Z,fem un pas endavant per apropar nos mes a la ciutadania i creem l appmossos per potenciar la comunicacio virtual en el marc del pla de transformacio tecnologica del cos   ,0
620,Mossos,1,2023-03-20T11:16:01.000Z,l appmossos sera un canal mes en aquest ecosistema virtual que el cos anira oferint paulatinament a la ciutadania i que preten aproximar se encara mes a la societat per incrementar i millorar la seguretat i els serveis policials que s ofereixen,0
621,Mossos,1,2023-03-20T11:22:49.000Z,esta dissenyada en catala  castella  aranes i angles i la seva descarrega es gratuita esta disponible en aquests sistemes operatius   android     ios      appmossos,0
622,Mossos,46,2023-03-20T10:00:47.000Z,un agent fora de servei que imparteix classes a una universitat de barcelona veu com una persona esta retenint una altra que acabava de fer el furt de dos portatils dins d una aula dete l autor que havia aprofitat el descans entre classes per colar se i furtar els ordinadors,1
623,Mossos,82,2023-03-20T06:54:11.000Z,torna l estafa del fill que et demana diners per whatsapp des d un altre mobil amb alguna d aquestes excuses   no piquis  stopestafes,0
624,Mossos,13,2023-03-19T19:21:08.000Z,avui es dia de   fcbarcelona_cat      realmadrid  i nosaltres tenim el dispositiu de seguretat a punt gaudeix del partit amb civisme i respecta el rival  elclassic,0
625,Mossos,6,2023-03-19T17:07:20.000Z,els estafadors aprofiten els periodes de vacances per enganyar aquells que busquen ofertes per internet per evitar caure en el parany i que les vacances et surtin cares  segueix els nostres consells de seguretat ,0
626,Mossos,11,2023-03-19T13:12:12.000Z,dema comenca la   voltacatalunya  i com cada any farem la proteccio de la caravana que acompanya el pilot durant totes les etapes estigues atent a les banderes que porten les nostres motos i segueix les indicacions dels agents etapa 1   ,0
627,Mossos,30,2023-03-19T10:05:17.000Z,detenim quatre lladres molt actius en comercos del districte d horta guinardo a barcelona que acumulen prop de 100 antecedents policials un dels detinguts ha ingressat a preso  ,1
628,Mossos,16,2023-03-18T19:57:59.000Z,a la carretera  vigila tambe les teves pertinences i objectes de valor si t atures per posar benzina o fer un descans en la conduccio i baixes del vehicle  tanca l els lladres aprofiten qualsevol distraccio  stopfurts,0
629,Mossos,6,2023-03-18T18:04:41.000Z,continuem treballant perque el 29 4 pugueu gaudir de la caminada solidaria   camialteucostat  el president del   govern     perearagones   ja te la samarreta  ara nomes faltes tu inscriu te o compra la samarreta   ,0
630,Mossos,5,2023-03-18T14:50:48.000Z,t has plantejat formar part dels mossos d esquadra  al   saloensenyament  t assessorem sobre l acces i les possibilitats professionals t hi esperem  dema es l ultim dia  ensfaltestu  saloensenyament  sigueselquevolsser,0
631,Mossos,17,2023-03-18T10:43:36.000Z,detenim un home per 11 robatoris violents en farmacies de barcelona d on s havia endut prop de 10.000 euros utilitzava una pistola simulada per intimidar les treballadores el detingut ja ha ingressat a preso  ,1
632,Mossos,11,2023-03-18T09:12:15.000Z,detenim un home a calafell per falsificacio i estafa immobiliaria  la victima  que va confiar en aquest fals assessor  va perdre mes de 151.000 euros en la suposada compra d un habitatge   ,1
633,Mossos,16,2023-03-17T20:01:04.000Z,detenim un lladre per robar dins sis trasters i aparcaments de figueres  principalment sostreia bicicletes el jutge n ha decretat l ingres a preso,1
634,Mossos,9,2023-03-17T18:02:13.000Z,ens reunim amb les policies locals per organitzar el dispositiu de seguretat de la 102a edicio de la   voltacatalunya  la coordinacio en les interseccions durant el recorregut es necessari per garantir la seguretat dels participants i dels usuaris de la via  voltacatalunya2023,0
635,Mossos,19,2023-03-17T16:16:22.000Z,detenim 8 homes en menys de 24h per cometre delictes contra el patrimoni a la regio policial de girona els lladres han assaltat magatzems  empreses i domicilis de palafrugell  bonmati  lloret de mar i castello d empuries,1
636,Mossos,18,2023-03-17T14:48:20.000Z,un any mes  homenatgem el company santos santamaria mort en atemptat terrorista fa 22 anys a roses en el nostre record estan sempre tots els companys que hem perdut en acte de servei sempre amb nosaltres,0
637,ACA,21,2023-03-17T10:38:37.000Z,es restringeixen temporalment els accessos a l   embassament de  sau per motius de seguretat   ,0
638,Mossos,10,2023-03-17T12:14:06.000Z,les distraccions al volant son la primera causa d accidentalitat a la carretera  al cotxe desa el mobil i concentra t en la conduccio  volemquetornis,0
